ID,Nom,Email,Téléphone,Commentaire
XF93LRT7Q2,Jean Dupont,jean.dupont@example.com,01 23 45 67 89,Le service était excellent !
PT78QV6XZ3,Marie Curie,marie.curie@example.com,06 78 90 12 34,Je suis très déçue par la qualité du produit.
LK45ZYP9T4,Paul Verne,paul.verne@example.com,07 65 43 21 09,"Livraison rapide, mais produit légèrement endommagé."
ZW12XV8LR5,Sophie Martin,sophie.martin@example.com,09 87 65 43 21,"Le rapport qualité-prix est top, je recommande !"
QR07VT3WY6,Lucas Durant,lucas.durant@example.com,01 12 34 56 78,"Support client très lent, mais le problème a été résolu."
